{"$schema":"https://json-schema.org/draft/2020-12/schema","$id":"urn:aicontrolcenter:governance:v1:mutation-budget","title":"GovernanceMutationBudget","type":"object","additionalProperties":false,"required":["schema_version","budget_id","authorization_id","status","line_items","remaining_count","violation_reason_code"],"properties":{"schema_version":{"const":"governance/v1"},"budget_id":{"$ref":"#/$defs/text"},"authorization_id":{"$ref":"#/$defs/text"},"status":{"$ref":"#/$defs/status"},"line_items":{"type":"array","minItems":1,"uniqueItems":true,"items":{"type":"object","additionalProperties":false,"required":["action_type","allowed_count","actual_invocation_count","completed_count","uncertain_count","remaining_count","status"],"properties":{"action_type":{"$ref":"#/$defs/action"},"allowed_count":{"type":"integer","minimum":1},"actual_invocation_count":{"type":"integer","minimum":0},"completed_count":{"type":"integer","minimum":0},"uncertain_count":{"type":"integer","minimum":0},"remaining_count":{"type":"integer","minimum":0},"status":{"$ref":"#/$defs/status"}}}},"remaining_count":{"type":"integer","minimum":0},"violation_reason_code":{"oneOf":[{"$ref":"#/$defs/code"},{"type":"null"}]}},"$defs":{"text":{"type":"string","minLength":1},"code":{"type":"string","pattern":"^[A-Z][A-Z0-9]*(?:_[A-Z0-9]+)*$"},"action":{"type":"string","pattern":"^[A-Z][A-Z0-9]*(?:[_:.][A-Z0-9]+)+$","not":{"enum":["ACTION","EXECUTE","MUTATE","WRITE"]}},"status":{"enum":["AVAILABLE","CONSUMED","EXHAUSTED","VIOLATED"]},"invocation_outcome":{"enum":["COMPLETED","CONFIRMED_ZERO_EFFECT","UNCERTAIN"]}}}
